id,image_id,caption,filename0,filename1
220798,564629,A kitchen with wooden walls and cabinets and a metal sink.,coco2017/train2017/000000564629.jpg,coco_latent_t2i/train2017/ann000000220798.png
594219,317715,Two spoke tires with white walls are parked.,coco2017/train2017/000000317715.jpg,coco_latent_t2i/train2017/ann000000594219.png
744554,354132,There is a man standing next to a motor cycle.,coco2017/train2017/000000354132.jpg,coco_latent_t2i/train2017/ann000000744554.png
393890,405248,A wooden bench covered with pots and containers of plants.,coco2017/train2017/000000405248.jpg,coco_latent_t2i/train2017/ann000000393890.png
339109,313386,Airplanes on a runway with one taking off in the background,coco2017/train2017/000000313386.jpg,coco_latent_t2i/train2017/ann000000339109.png
682635,255244,A cat laying on the back of a chair in a room.,coco2017/train2017/000000255244.jpg,coco_latent_t2i/train2017/ann000000682635.png
752816,163065,A boat parked at a large loading dock.,coco2017/train2017/000000163065.jpg,coco_latent_t2i/train2017/ann000000752816.png
442714,224567,A brown dog is catching a blue Frisbee.,coco2017/train2017/000000224567.jpg,coco_latent_t2i/train2017/ann000000442714.png